{
  "schema_version": "1.0",
  "precision_teaching_context": {
    "subject": "科学",
    "grade": "八年级",
    "textbook_version_and_chapter": "通用示例·生态系统",
    "precision_teaching_topic": "食物网中生物数量变化的证据推理",
    "precision_teaching_goals": [
      "依据食物网信息解释一种生物数量变化对其他种群的影响",
      "能够在新情境中检验原有解释的适用条件"
    ],
    "precision_teaching_content": [
      "食物关系",
      "种群数量变化",
      "证据—关系—结论"
    ]
  },
  "diagnosis_bundle": {
    "class_summary": {
      "total_students": 4,
      "distribution": {
        "P": {"count": 1, "student_ids": ["S-01"]},
        "U": {"count": 0, "student_ids": []},
        "M": {"count": 2, "student_ids": ["S-02", "S-03"]},
        "R": {"count": 1, "student_ids": ["S-04"]},
        "EA": {"count": 0, "student_ids": []}
      }
    },
    "traceability": {
      "levels_unchanged": true,
      "level_assignments": [
        {"student_id": "S-01", "student_name": "学生甲", "level": "P"},
        {"student_id": "S-02", "student_name": "学生乙", "level": "M"},
        {"student_id": "S-03", "student_name": "学生丙", "level": "M"},
        {"student_id": "S-04", "student_name": "学生丁", "level": "R"}
      ]
    },
    "class_diagnosis": "一名学生尚未进入任务，两名学生能列出多项变化但没有建立食物关系链，一名学生能够解释关系但需要检验适用条件。"
  },
  "teacher_instructional_context": {
    "teaching_content_and_curriculum_analysis": "本课围绕食物网中的种群关系解释，引导学生从识别直接关系发展到利用多项证据解释种群变化。",
    "teaching_focus_and_difficulty_analysis": "重点是建立生物之间的食物关系及种群变化关系；难点是把多项变化组织成有因果联系的解释链，并检验解释的适用条件。",
    "planned_duration_minutes": 45,
    "teaching_environment_and_ai_support_conditions": "普通教室，有投影、食物网图、数据卡和纸质学习单；一台共享平板可用于迁移检验，学生先独立作答。",
    "teacher_lesson_conception": "希望学生先独立观察食物网，再按不同进阶目标学习，最后共同形成关系图。"
  },
  "goal_path_design": {
    "schema_version": "1.1",
    "design_status": "teacher_confirmed",
    "common_core_goal": {
      "goal_id": "CG",
      "goal_content": "依据食物网证据解释种群变化，并说明结论成立的条件。",
      "observable_attainment": "学生能用图中关系和数据支持结论。"
    },
    "progression_goals": [
      {
        "goal_id": "PG1",
        "goal_level": "U 单点结构目标",
        "target_student_ids": ["S-01"],
        "goal_content": "找到一条与问题直接相关的食物关系。",
        "observable_attainment": "独立指出一种捕食关系及其涉及的两种生物。"
      },
      {
        "goal_id": "PG2",
        "goal_level": "R 关联结构目标",
        "target_student_ids": ["S-02", "S-03"],
        "goal_content": "把多项信息连成食物关系链并据此解释种群变化。",
        "observable_attainment": "画出至少两步关系并说明每一步如何支持结论。"
      },
      {
        "goal_id": "PG3",
        "goal_level": "EA 拓展抽象目标",
        "target_student_ids": ["S-04"],
        "goal_content": "改变一个条件，检验并修正原有解释。",
        "observable_attainment": "指出条件变化后原解释是否适用，并说明修正理由。"
      }
    ],
    "student_goal_assignments": [
      {"student_id": "S-01", "goal_id": "PG1"},
      {"student_id": "S-02", "goal_id": "PG2"},
      {"student_id": "S-03", "goal_id": "PG2"},
      {"student_id": "S-04", "goal_id": "PG3"}
    ],
    "intervention_path": {
      "primary": {
        "path_type": "并行分层型",
        "total_duration_minutes": 45,
        "stages": [
          {
            "stage_id": "ST1",
            "stage_name": "共同定向",
            "duration_minutes": 5,
            "activity_units": [
              {
                "unit_id": "ST1-C1",
                "organization_code": "C",
                "organization_name": "全班共同活动",
                "activity_name": "明确解释任务与证据要求",
                "target_goal_ids": ["PG1", "PG2", "PG3"],
                "target_student_ids": ["S-01", "S-02", "S-03", "S-04"],
                "activity_summary": "明确问题和证据使用要求。"
              }
            ]
          },
          {
            "stage_id": "ST2",
            "stage_name": "分层探究",
            "duration_minutes": 20,
            "activity_units": [
              {
                "unit_id": "ST2-I1",
                "organization_code": "I",
                "organization_name": "个体学习或个别支持",
                "activity_name": "识别食物网中的直接关系",
                "target_goal_ids": ["PG1"],
                "target_student_ids": ["S-01"],
                "activity_summary": "在食物网图中识别一条相关关系。"
              },
              {
                "unit_id": "ST2-H1",
                "organization_code": "H",
                "organization_name": "同质小组活动",
                "activity_name": "建构种群变化的关系链",
                "target_goal_ids": ["PG2"],
                "target_student_ids": ["S-02", "S-03"],
                "activity_summary": "把多项证据组织成关系链。"
              },
              {
                "unit_id": "ST2-I2",
                "organization_code": "I",
                "organization_name": "个体学习或个别支持",
                "activity_name": "迁移检验生态解释",
                "target_goal_ids": ["PG3"],
                "target_student_ids": ["S-04"],
                "activity_summary": "用条件变化检验并修正解释。"
              }
            ]
          },
          {
            "stage_id": "ST3",
            "stage_name": "共同汇聚",
            "duration_minutes": 10,
            "activity_units": [
              {
                "unit_id": "ST3-C1",
                "organization_code": "C",
                "organization_name": "全班共同活动",
                "activity_name": "共建种群变化解释框架",
                "target_goal_ids": ["PG1", "PG2", "PG3"],
                "target_student_ids": ["S-01", "S-02", "S-03", "S-04"],
                "activity_summary": "比较不同解释并形成共同关系图。"
              }
            ]
          },
          {
            "stage_id": "ST4",
            "stage_name": "综合应用",
            "duration_minutes": 10,
            "activity_units": [
              {
                "unit_id": "ST4-A1",
                "organization_code": "A",
                "organization_name": "综合应用",
                "activity_name": "运用框架解释新食物网",
                "target_goal_ids": ["PG1", "PG2", "PG3"],
                "target_student_ids": ["S-01", "S-02", "S-03", "S-04"],
                "activity_summary": "在新食物网中完成一次解释。"
              }
            ]
          }
        ]
      }
    },
    "teacher_confirmation": {"status": "teacher_confirmed"}
  },
  "teacher_activity_requirements": {
    "fixed_learning_materials": ["食物网图", "种群变化数据卡"],
    "required_activities": ["保留共同汇聚"],
    "prohibited_approaches": ["教师连续讲解超过5分钟"],
    "ai_access": "shared",
    "ai_use_constraints": ["学生先独立作答，AI只提供反例"],
    "teacher_notes": ["活动说明尽量简洁"]
  }
}
